,名称,类别,申报单位,保护单位
959,宣舞（普堆巴宣舞）,新增项目,西藏自治区墨竹工卡县,墨竹工卡县文化和旅游局（墨竹工卡县文物局）
960,宣舞（札达卡尔玛宣舞）,扩展项目,西藏自治区阿里地区,阿里地区群众艺术馆
961,拉萨囊玛,新增项目,西藏自治区拉萨市,拉萨市城关区娘热民间艺术有限公司
962,堆谐（拉孜堆谐）,新增项目,西藏自治区拉孜县,拉孜县文化和旅游局（拉孜县文物局）
963,堆谐（甘孜踢踏）,扩展项目,四川省甘孜县,甘孜县文化馆
964,谐钦（拉萨纳如谐钦）,新增项目,西藏自治区拉萨市城关区,拉萨市文化局
965,谐钦（南木林土布加谐钦）,新增项目,西藏自治区南木林县,南木林县文化和旅游局
966,谐钦（尼玛乡谐钦）,扩展项目,西藏自治区班戈县,西藏那曲市班戈县文化和旅游局
967,阿谐（达布阿谐）,新增项目,西藏自治区比如县,西藏那曲市比如县文化和旅游局
968,嘎尔,新增项目,西藏自治区,西藏自治区群众艺术馆（西藏自治区非物质文化遗产保护中心）
969,芒康三弦舞,新增项目,西藏自治区芒康县,西藏自治区昌都市芒康县文化局
970,定日洛谐,新增项目,西藏自治区定日县,定日县文化和旅游局
971,旦嘎甲谐,新增项目,西藏自治区萨嘎县,萨嘎县文化和旅游局
972,廓孜,新增项目,西藏自治区曲水县,曲水县文化和旅游局（曲水县文物局）
973,多地舞,新增项目,甘肃省舟曲县,舟曲县文化馆
974,巴郎鼓舞,新增项目,甘肃省卓尼县,卓尼县文化馆
975,藏族螭鼓舞,新增项目,青海省循化撒拉族自治县,循化撒拉族自治县文化馆
976,则柔（尚尤则柔）,新增项目,青海省贵德县,贵德县人民文化馆
977,蒙古族萨吾尔登,新增项目,新疆维吾尔自治区和静县,和静县东归文化馆
978,萨吾尔登,扩展项目,新疆维吾尔自治区博湖县,博湖县非物质文化遗产保护中心
979,萨吾尔登,扩展项目,内蒙古自治区阿拉善盟额济纳旗,额济纳旗文化馆
980,锡伯族贝伦舞,新增项目,新疆维吾尔自治区察布查尔锡伯自治县,察布查尔锡伯自治县文化馆
981,维吾尔族赛乃姆,新增项目,新疆维吾尔自治区哈密地区,哈密市非物质文化遗产保护中心
982,维吾尔族赛乃姆,新增项目,新疆维吾尔自治区莎车县,莎车县文化馆
983,赛乃姆（若羌赛乃姆）,扩展项目,新疆维吾尔自治区若羌县,若羌县文化馆
984,赛乃姆（且末赛乃姆）,扩展项目,新疆维吾尔自治区且末县,且末县文化馆
985,赛乃姆（库尔勒赛乃姆）,扩展项目,新疆维吾尔自治区库尔勒市,库尔勒市文化馆
986,赛乃姆（伊犁赛乃姆）,扩展项目,新疆维吾尔自治区伊宁县,伊宁县文化馆（伊宁县文化艺术中心）
987,赛乃姆（库车赛乃姆）,扩展项目,新疆维吾尔自治区库车县,库车县文化馆
988,赛乃姆（和田赛乃姆）,扩展项目,新疆维吾尔自治区于田县,于田县文化馆
989,跳马,新增项目,江苏省如东县,如东县文化馆
990,仗鼓舞（桑植仗鼓舞）,新增项目,湖南省桑植县,桑植县非物质文化遗产保护中心
991,南县地花鼓,新增项目,湖南省南县,南县文化馆
992,跳花棚,新增项目,广东省化州市,化州市文化馆
993,老古舞,新增项目,海南省白沙黎族自治县,海南省白沙黎族自治县文化馆
994,跳曹盖,新增项目,四川省平武县,平武县非物质文化遗产保护中心
995,棕扇舞,新增项目,云南省元江哈尼族彝族傣族自治县,元江县文化馆
996,鄂温克族萨满舞,新增项目,内蒙古自治区根河市,根河市文化馆
997,协荣仲孜,新增项目,西藏自治区曲水县,曲水县文化和旅游局（曲水县文物局）
998,普兰果尔孜,新增项目,西藏自治区阿里地区,阿里地区群众艺术馆
999,陈塘夏尔巴歌舞,新增项目,西藏自治区定结县,定结县文化和旅游局
1000,巴当舞,新增项目,甘肃省岷县,岷县文化馆
1001,安昭,新增项目,青海省互助土族自治县,互助土族自治县文化馆
1002,萨玛舞,新增项目,新疆维吾尔自治区喀什市,喀什市文化馆
1003,哈萨克族卡拉角勒哈,新增项目,新疆维吾尔自治区伊犁哈萨克自治州,伊犁哈萨克自治州文化艺术研究所
1004,太子务武吵子,新增项目,北京市大兴区 ,北京市大兴区榆垡镇太子务村股份经济合作社
1005,左权小花戏,新增项目,山西省左权县 ,左权县人民文化馆
1006,博舞,新增项目,吉林省前郭尔罗斯蒙古族自治县 ,前郭尔罗斯蒙古族自治县草原文化馆
1007,洪泽湖渔鼓,新增项目,江苏省洪泽县 ,淮安市洪泽区文化馆
1008,洪泽湖渔鼓,新增项目,江苏省泗洪县 ,泗洪县文化馆
1009,龙岩采茶灯,新增项目,福建省龙岩市新罗区 ,龙岩市新罗区龙岩采茶灯研究会
1010,宜黄禾杠舞,新增项目,江西省宜黄县 ,宜黄县文化馆
1011,耍老虎,新增项目,河南省焦作市 ,焦作市文化馆（焦作市非物质文化遗产保护中心）
1012,棕包脑,新增项目,湖南省洞口县 ,洞口县非物质文化遗产保护中心
1013,瑶族金锣舞,新增项目,广西壮族自治区田东县 ,田东县文化馆
1014,玩牛,新增项目,重庆市石柱土家族自治县 ,石柱土家族自治县文化生态保护管理中心
1015,古蔺花灯,新增项目,四川省古蔺县 ,古蔺县文化馆
1016,登嘎甘V（熊猫舞）,新增项目,四川省九寨沟县 ,九寨沟县文化馆
1017,阿妹戚托,新增项目,贵州省晴隆县 ,晴隆县文化馆
1018,布依族转场舞,新增项目,贵州省册亨县 ,册亨县文化馆
1019,耳子歌,新增项目,云南省大理白族自治州 ,云龙县文化馆
1020,鼓舞,新增项目,云南省建水县 ,建水县非物质文化遗产保护中心
1021,水鼓舞,新增项目,云南省瑞丽市 ,瑞丽市文化馆
1022,怒族达比亚舞,新增项目,云南省福贡县 ,福贡县文化馆
1023,锅哇（玉树武士舞）,新增项目,青海省玉树藏族自治州 ,玉树州民间文化艺术协会
1024,纳孜库姆,新增项目,新疆维吾尔自治区吐鲁番市,吐鲁番市高昌区文化馆
1025,六郎庄五虎棍,新增项目,北京市海淀区,北京万柳置业集团有限公司
1026,翼城浑身板,新增项目,山西省临汾市翼城县,翼城县人民文化馆
1027,泰兴花鼓,新增项目,江苏省泰州市泰兴市,泰兴市文化馆
1028,佾舞,新增项目,福建省福州市福清市,福清市立达孔学会
1029,阴阳板,新增项目,山东省济宁市邹城市,邹城市文化旅游公共服务中心（邹城市图书馆、邹城市文化馆）
1030,海南苗族盘皇舞,新增项目,海南省五指山市,五指山市文化馆
1031,多耶,新增项目,广西壮族自治区柳州市三江侗族自治县,三江侗族自治县文化馆（三江侗族自治县非物质文化遗产保护与发展中心）
1032,壮族打扁担,新增项目,广西壮族自治区河池市都安瑶族自治县,都安瑶族自治县文化馆
1033,苗族古瓢舞,新增项目,贵州省黔东南苗族侗族自治州,黔东南州非物质文化遗产保护中心
1034,傣族白象、马鹿舞,新增项目,云南省,云南省非物质文化遗产保护中心
1035,陇西云阳板,新增项目,甘肃省定西市陇西县,甘肃省陇西县文化馆
1036,黄羊钱鞭,新增项目,宁夏回族自治区中卫市中宁县,中宁县文化馆
1037,俄罗斯族踢踏舞,新增项目,新疆维吾尔自治区塔城地区塔城市,塔城市文化馆
1038,昆曲,新增项目,北京市,北方昆曲剧院
1039,昆曲,新增项目,上海市,上海昆剧团
1040,昆曲,新增项目,江苏省,江苏省演艺集团有限公司，江苏省苏州昆剧院
1041,昆曲,新增项目,浙江省,永嘉昆剧团（浙江永嘉昆曲传习所）
1042,昆曲,新增项目,湖南省,湖南省昆剧团
1043,昆曲,新增项目,中国艺术研究院,中国艺术研究院
1044,梨园戏,新增项目,福建省泉州市,福建省梨园戏传承中心（福建省梨园戏实验剧团）
1045,莆仙戏,新增项目,福建省莆田市,莆田市艺术研究所
1046,潮剧,新增项目,广东省潮州市,潮州市潮剧团
1047,潮剧,新增项目,广东省汕头市,汕头市潮剧潮乐传承中心（广东潮剧院）
1048,潮剧,扩展项目,广东省揭阳市,揭阳市潮剧传承保护中心
1049,潮剧,扩展项目,福建省云霄县,云霄县潮剧传承保护中心
1050,弋阳腔,新增项目,江西省弋阳县,弋阳腔艺术保护中心
1051,青阳腔,新增项目,安徽省青阳县,青阳县文化馆
1052,青阳腔,新增项目,江西省湖口县,湖口县非物质文化遗产保护研究会
1053,高腔（西安高腔）,新增项目,浙江省衢州市,衢州市西安高腔传习所
1054,高腔（松阳高腔）,新增项目,浙江省松阳县,松阳县文化馆
1055,高腔（岳西高腔）,新增项目,安徽省岳西县,岳西高腔传承中心
1056,高腔（辰河高腔）,新增项目,湖南省辰溪县,辰溪县高腔艺术保护传承中心
1057,高腔（辰河高腔）,新增项目,湖南省泸溪县,泸溪县辰河高腔传习所
1058,高腔（常德高腔）,新增项目,湖南省常德市,常德市汉剧高腔保护中心
1059,新昌调腔,新增项目,浙江省新昌县,新昌县调腔保护传承发展中心
1060,宁海平调,新增项目,浙江省宁海县,宁海县平调艺术传承中心
1061,永安大腔戏,新增项目,福建省永安市,永安市青水畲族乡社会事务综合服务中心（加挂“永安市青水畲族乡退役军人服务站”牌子）
1062,四平戏,新增项目,福建省屏南县,屏南龙潭四平戏剧团
1063,四平戏,新增项目,福建省政和县,政和县文化馆
1064,川剧,新增项目,重庆市,重庆市川剧院
1065,川剧,新增项目,四川省,四川省艺术研究院
1066,湘剧,新增项目,湖南省衡阳市,衡阳湘剧艺术有限责任公司
1067,湘剧（涟源湘剧）,扩展项目,湖南省娄底市涟源市,涟源市湘剧保护传承中心
1068,广昌孟戏,新增项目,江西省广昌县,江西省广昌县文化馆
1069,正字戏,新增项目,广东省陆丰市,陆丰市正字戏传承保护中心
1070,秦腔,新增项目,陕西省,西安易俗社文化研究院
1071,秦腔,扩展项目,甘肃省秦剧团,甘肃秦腔艺术剧院有限责任公司
1072,秦腔 ,扩展项目,宁夏回族自治区,宁夏演艺集团秦腔剧院有限公司
1073,秦腔 ,扩展项目,新疆生产建设兵团 ,新疆生产建设兵团猛进秦剧团
1074,汉调桄桄,新增项目,陕西省汉中市,汉中市群众艺术馆（汉中市非物质文化遗产保护中心）
1075,晋剧,新增项目,山西省,山西省晋剧院
1076,晋剧,扩展项目,河北省张家口市,张家口戏曲艺术研究院
1077,晋剧,扩展项目,山西省太原市,太原市晋剧艺术研究院
1078,晋剧,扩展项目,河北省井陉县,井陉县文化馆
1079,晋剧,扩展项目,内蒙古自治区呼和浩特市,呼和浩特市群众艺术馆
1080,晋剧 ,扩展项目,山西省晋中市 ,晋中市晋剧和民间艺术研究院
1081,蒲州梆子,新增项目,山西省临汾市,临汾蒲剧院
1082,蒲州梆子,新增项目,山西省运城市,山西省运城市蒲剧团
1083,北路梆子,新增项目,山西省忻州市,忻州文化研究院（五台山研究院）
1084,北路梆子,扩展项目,山西省大同市,大同市北路梆子和耍孩剧种保护传习中心
1085,上党梆子,新增项目,山西省晋城市,晋城市文化和旅游发展研究中心
1086,上党梆子,扩展项目,山西省长治市,长治市上党梆子剧团
1087,河北梆子,新增项目,河北省,河北省河北梆子剧院演艺有限公司
1088,河北梆子,扩展项目,北京市河北梆子剧团,北京市河北梆子剧团有限责任公司
1089,河北梆子,扩展项目,天津河北梆子剧院,天津河北梆子剧院
1090,豫剧,新增项目,河南省,河南省非物质文化遗产保护和智慧化中心
1091,豫剧（桑派）,扩展项目,河北省邯郸市,邯郸市东风剧团
1092,豫剧,扩展项目,新疆生产建设兵团,新疆生产建设兵团豫剧团
1093,宛梆,新增项目,河南省内乡县,内乡县宛梆艺术传承保护中心
1094,怀梆,新增项目,河南省沁阳市,沁阳市怀梆艺术保护传承中心
1095,大平调,新增项目,河南省濮阳县,濮阳县大平调艺术保护传承中心
1096,大平调,新增项目,河南省滑县,滑县大平调剧团
1097,大平调,新增项目,河南省延津县,延津县大平调艺术传承保护中心
1098,大平调,扩展项目,山东省东明县,东明县地方戏曲非遗保护传承中心
1099,大平调,扩展项目,山东省菏泽市牡丹区,菏泽市牡丹区大平调非遗保护传承中心
1100,大平调,扩展项目,山东省成武县,成武县文化馆
1101,大平调,扩展项目,河南省浚县,浚县大平调传承保护中心
1102,越调,新增项目,河南省周口市,河南省越调艺术保护传承中心
1103,越调,扩展项目,河南省许昌市,许昌市戏曲艺术发展中心（许昌市越调艺术保护传承中心）
1104,越调,扩展项目,河南省邓州市,邓州市越调剧团
1105,越调 ,扩展项目,湖北省谷城县 ,谷城县文化馆
1106,京剧,新增项目,北京市,北京京剧院
1107,京剧,新增项目,天津市,天津京剧院
1108,京剧,新增项目,辽宁省,沈阳市公共文化服务中心（沈阳市文化演艺中心）
1109,京剧,新增项目,上海市,上海京剧院
1110,京剧,新增项目,山东省,山东省京剧院
1111,京剧,新增项目,中国京剧院,中国京剧院
1112,京剧,扩展项目,湖北省京剧院,湖北省京剧院
1113,京剧,扩展项目,江苏省演艺集团,江苏省演艺集团有限公司
1114,京剧,扩展项目,江苏省淮安市,江苏省长荣京剧院
1115,徽剧,新增项目,安徽省,安徽省徽京剧院
1116,徽剧,新增项目,安徽省黄山市,黄山市徽剧院（黄山市艺术研究所）
1117,徽剧,新增项目,江西省婺源县,婺源县徽剧传习所
1118,汉剧,新增项目,湖北省武汉市,武汉汉剧院
1119,汉调二簧,新增项目,陕西省安康市,安康市群众艺术馆
1120,汉调二簧,扩展项目,湖北省竹溪县,竹溪县山二黄剧种保护传承展演中心
1121,泰宁梅林戏,新增项目,福建省泰宁县,泰宁县梅林戏艺术传承保护中心
1122,闽西汉剧,新增项目,福建省龙岩市,龙岩市汉剧传习中心
1123,巴陵戏,新增项目,湖南省岳阳市,岳阳市巴陵戏传承研究院
1124,荆河戏,新增项目,湖南省澧县,澧县荆河剧院
1125,荆河戏,扩展项目,湖北省荆州市,荆州市群众艺术馆（荆州市艺术研究所）
1126,粤剧,新增项目,广东省文化厅,广东粤剧院
1127,粤剧,新增项目,广东省广州市,广州文学艺术创作研究院
1128,粤剧,新增项目,广东省佛山市,佛山粤剧传习所（佛山市粤剧院）
1129,粤剧,新增项目,香港特别行政区民政事务局,香港特别行政区政府文化体育及旅游局
1130,粤剧,新增项目,澳门特别行政区文化局,澳门特别行政区政府文化局
1131,粤剧 ,扩展项目,广东省吴川市,吴川市粤剧南派艺术传承中心
1132,粤剧 ,扩展项目,广西壮族自治区南宁市 ,南宁市民族文化艺术研究院（南宁市戏剧院、南宁市非物质文化遗产保护中心）
1133,桂剧,新增项目,广西壮族自治区,广西壮族自治区戏剧院
1134,宜黄戏,新增项目,江西省宜黄县,宜黄县文化馆
1135,乱弹,新增项目,浙江省台州市,浙江台州乱弹剧团
1136,乱弹,新增项目,浙江省浦江县,浦江县文化馆
1137,乱弹（威县乱弹）,扩展项目,河北省威县,威县文化馆（威县美术馆）
1138,乱弹（诸暨西路乱弹）,扩展项目,浙江省诸暨市,诸暨市博物馆
1139,乱弹（南岩乱弹） ,扩展项目,河北省高邑县 ,高邑县万城乡南岩乱弹剧团
1140,石家庄丝弦,新增项目,河北省石家庄市,石家庄市丝弦剧团
1141,雁北耍孩儿,新增项目,山西省大同市,大同市北路梆子和耍孩剧种保护传习中心
1142,灵丘罗罗腔,新增项目,山西省灵丘县,灵丘县罗罗腔剧种传习中心
1143,柳子戏,新增项目,山东省,山东省柳子戏艺术保护传承中心（山东省柳子剧团）
1144,柳子戏,扩展项目,河南省清丰县,清丰县柳子戏艺术传承中心
1145,大弦戏,新增项目,河南省滑县,滑县大弦戏剧团
1146,大弦戏,新增项目,河南省濮阳县,濮阳县大弦戏艺术保护传承中心
1147,大弦戏,扩展项目,山东省菏泽市,菏泽市地方戏曲传承研究院
1148,闽剧,新增项目,福建省福州市,福州闽剧艺术传承发展中心
1149,寿宁北路戏,新增项目,福建省寿宁县,寿宁县北路戏保护传承中心
1150,西秦戏,新增项目,广东省海丰县,海丰县西秦戏艺术传承中心
1151,高甲戏,新增项目,福建省泉州市,泉州市高甲戏传承中心（泉州市高甲戏剧团、泉州市打城戏传承中心、泉州市打城戏传习所）
1152,高甲戏,新增项目,福建省厦门市,厦门市金莲高甲剧团
1153,高甲戏（柯派）,扩展项目,福建省晋江市,晋江市高甲柯派表演艺术中心
1154,碗碗腔（孝义碗碗腔）,新增项目,山西省孝义市,孝义市碗碗腔剧团演出有限公司
1155,碗碗腔（曲沃碗碗腔）,扩展项目,山西省曲沃县,曲沃县晋韵碗碗腔演艺有限责任公司
1156,碗碗腔（渭南碗碗腔）,扩展项目,陕西省渭南市临渭区,渭南市临渭区文化馆
1157,四平调,新增项目,河南省商丘市,商丘市梁园区四平调艺术研究中心
1158,四平调,新增项目,河南省濮阳市,范县四平调艺术传播研究中心
1159,四平调,扩展项目,山东省金乡县,金乡县公共文化服务中心（金乡县文化馆、金乡县图书馆）
1160,四平调,扩展项目,山东省成武县,成武县四平调保护传承中心
1161,四平调 ,扩展项目,安徽省砀山县 ,砀山县文化馆
1162,评剧,新增项目,天津市宝坻区,天津市宝坻区文化馆（天津市宝坻区文化遗产保护中心、天津市宝坻区青少年活动中心）
1163,评剧,新增项目,河北省滦南县,滦南县“冀东文艺三枝花”研究保护中心
1164,评剧,新增项目,辽宁省沈阳市,沈阳市公共文化服务中心（沈阳市文化演艺中心）
1165,评剧,扩展项目,北京市中国评剧院,中国评剧院有限责任公司，北京刘秀荣评剧团
1166,评剧,扩展项目,天津评剧院,天津评剧院
1167,评剧,扩展项目,河北省石家庄市,石家庄市评剧院一团
1168,评剧,扩展项目,辽宁省沈阳市和平区,沈阳市和平区文化创意产业发展协会
1169,评剧,扩展项目,黑龙江省评剧院,黑龙江省评剧艺术中心
1170,武安平调落子,新增项目,河北省武安市,武安市文化馆
1171,越剧,新增项目,上海市,上海越剧艺术传习所（上海越剧院）
1172,越剧,新增项目,浙江省,嵊州市越剧艺术保护传承中心
1173,越剧（尹派）,扩展项目,福建省芳华越剧团,福建省芳华越剧团
1174,沪剧,新增项目,上海市,上海沪剧艺术传习所（上海沪剧院）
1175,苏剧,新增项目,江苏省苏州市,苏州市苏剧传习保护中心
1176,扬剧,新增项目,江苏省扬州市,扬州市扬剧研究所
1177,扬剧,扩展项目,江苏省演艺集团扬剧团,江苏省演艺集团有限公司
1178,扬剧,扩展项目,江苏省镇江市,镇江市艺术剧院
1179,庐剧,新增项目,安徽省合肥市,合肥市庐剧院有限公司
1180,庐剧,新增项目,安徽省六安市,六安市皖西演艺传媒有限公司
1181,庐剧（东路庐剧）,扩展项目,安徽省和县,和县庐剧团有限责任公司
1182,楚剧,新增项目,湖北省,湖北省戏曲艺术剧院有限责任公司
1183,楚剧 ,扩展项目,湖北省孝感市 ,孝感市群众艺术馆（孝感市非物质文化遗产保护中心）
1184,荆州花鼓戏,新增项目,湖北省潜江市,湖北省花鼓戏艺术研究院（湖北省实验花鼓剧院）
1185,黄梅戏,新增项目,安徽省安庆市,安庆市黄梅戏（地方戏曲）研究院
1186,黄梅戏,新增项目,湖北省黄梅县,黄梅县黄梅戏剧院
1187,黄梅戏,扩展项目,安徽省黄梅戏剧院,安徽省黄梅戏剧院
1188,黄梅戏,扩展项目,湖北省,湖北省戏曲艺术剧院有限责任公司
1189,商洛花鼓,新增项目,陕西省商洛市,商洛市地方戏曲研究院
1190,泗州戏,新增项目,安徽省宿州市,安徽省宿州市泗州戏剧团
1191,泗州戏,新增项目,安徽省蚌埠市,安徽省泗州戏剧院有限责任公司
1192,泗州戏,扩展项目,江苏省泗洪县,泗洪县泗州戏剧团
1193,柳琴戏,新增项目,山东省枣庄市,枣庄市柳琴戏保护传承中心（枣庄市艺术剧院）
1194,柳琴戏,扩展项目,江苏省徐州市,徐州演艺集团有限公司
1195,柳琴戏,扩展项目,山东省临沂市,临沂市柳琴戏传承保护中心
1196,歌仔戏,新增项目,福建省漳州市,漳州市歌仔戏（芗剧）传承保护中心
1197,歌仔戏,新增项目,福建省厦门市,厦门歌仔戏研习中心
1198,采茶戏（赣南采茶戏）,新增项目,江西省赣州市,赣南艺术创作研究所
1199,采茶戏（桂南采茶戏）,新增项目,广西壮族自治区博白县,博白县文化馆
1200,采茶戏,扩展项目,湖北省阳新县,阳新采茶戏传承中心
1201,采茶戏（高安采茶戏）,扩展项目,江西省高安市,高安市文化馆
1202,采茶戏（抚州采茶戏）,扩展项目,江西省抚州市临川区,临川区抚州采茶戏传习所
1203,采茶戏（粤北采茶戏）,扩展项目,广东省韶关市,韶关市粤北采茶戏保护传承中心（韶关市粤北采茶戏剧院）
1204,采茶戏（吉安采茶戏）,扩展项目,江西省吉安市,吉安市采茶歌舞剧院
1205,五音戏,新增项目,山东省淄博市,淄博市五音戏艺术传承保护中心（淄博市五音戏剧院）
1206,茂腔,新增项目,山东省高密市,高密市艺术剧院
1207,茂腔,新增项目,山东省胶州市,胶州市文化服务中心
1208,茂腔,扩展项目,山东省青岛市黄岛区,青岛市黄岛区茂腔艺术传承中心
1209,曲剧,新增项目,河南省,河南省曲剧艺术保护传承中心
1210,曲子戏（敦煌曲子戏）,新增项目,甘肃省敦煌市,敦煌市文化馆
1211,曲子戏（华亭曲子戏）,新增项目,甘肃省华亭县,华亭市文化馆（华庭市美术馆）
1212,曲子戏,扩展项目,新疆生产建设兵团,新疆生产建设兵团第六师五家渠市文化体育广电和旅游局
1213,曲子戏,扩展项目,甘肃省白银市,白银市白银区文化馆
1214,曲子戏（民勤曲子戏）,扩展项目,甘肃省武威市民勤县,民勤县文化馆
1215,秧歌戏（隆尧秧歌戏）,新增项目,河北省隆尧县,隆尧县文化馆
1216,秧歌戏（定州秧歌戏）,新增项目,河北省定州市,定州市文化馆
1217,秧歌戏（朔州秧歌戏）,新增项目,山西省朔州市,朔州市朔城区大秧歌传承研究中心（朔州市朔城区大秧歌剧团）
1218,秧歌戏（繁峙秧歌戏）,新增项目,山西省繁峙县,繁峙县秧歌剧团
1219,秧歌戏（蔚县秧歌）,扩展项目,河北省蔚县,蔚县文化馆
1220,秧歌戏（祁太秧歌）,扩展项目,山西省祁县,祁县文化馆
1221,秧歌戏（祁太秧歌）,扩展项目,山西省太谷县,太谷县文化馆
1222,秧歌戏（襄武秧歌）,扩展项目,山西省襄垣县,襄垣县非物质文化遗产保护协会
1223,秧歌戏（襄武秧歌）,扩展项目,山西省武乡县,武乡县文化馆（武乡县美术馆）
1224,秧歌戏（壶关秧歌）,扩展项目,山西省壶关县,壶关县人民艺术剧团
1225,秧歌戏（泽州秧歌）,扩展项目,山西省泽州县,泽州县文化馆
1226,秧歌戏（沁源秧歌）,扩展项目,山西省长治市沁源县,沁源县文化馆
1227,道情戏（晋北道情戏）,新增项目,山西省右玉县,右玉县晋北道情剧团演出有限公司
1228,道情戏（临县道情戏）,新增项目,山西省临县,临县道情研究中心（吕梁市文化艺术中心）
1229,道情戏（太康道情戏）,新增项目,河南省太康县,太康县道情艺术保护传承中心
1230,道情戏（蓝关戏）,新增项目,山东省莱州市,莱州市文化馆
1231,道情戏（陇剧）,新增项目,甘肃省,甘肃省陇剧院
1232,道情戏（洪洞道情）,扩展项目,山西省洪洞县,洪洞县文化馆
1233,道情戏（沾化渔鼓戏）,扩展项目,山东省沾化县,滨州市沾化区非物质文化遗产保护传承中心（中国沾化渔鼓戏剧团）
1234,道情戏（神池道情戏）,扩展项目,山西省神池县,神池县文化旅游产业服务中心
1235,道情戏（商洛道情戏）,扩展项目,陕西省商洛市,商洛市地方戏曲研究院
1236,哈哈腔,新增项目,河北省清苑县,保定市清苑区哈哈腔剧团
1237,哈哈腔,新增项目,河北省青县,青县哈哈腔戏剧协会
1238,二人台,新增项目,河北省康保县,康保县文化馆
1239,二人台,新增项目,山西省河曲县,河曲县宣传事务中心
1240,二人台,新增项目,内蒙古自治区呼和浩特市,呼和浩特民族演艺集团二人台艺术研究剧院有限公司
1241,二人台,扩展项目,陕西省府谷县,府谷县文化馆
1242,二人台（东路二人台）,扩展项目,内蒙古自治区乌兰察布市,乌兰察布市民族艺术剧院
