,名称,类别,申报单位,保护单位
2697,绿茶制作技艺（信阳毛尖茶制作技艺） ,扩展项目,河南省信阳市,信阳市茶叶商会
2698,绿茶制作技艺（恩施玉露制作技艺） ,扩展项目,湖北省恩施市,恩施玉露茶产业协会
2699,绿茶制作技艺（都匀毛尖茶制作技艺） ,扩展项目,贵州省都匀市 ,都匀市文物保护研究中心
2700,绿茶制作技艺（雨花茶制作技艺）,扩展项目,江苏省南京市,南京盛峰茶业有限公司
2701,绿茶制作技艺（蒙山茶传统制作技艺）,扩展项目,四川省雅安市,雅安市名山区非物质文化遗产保护中心
2702,红茶制作技艺（祁门红茶制作技艺）,新增项目,安徽省祁门县,祁门县祁门红茶协会
2703,红茶制作技艺（滇红茶制作技艺） ,扩展项目,云南省凤庆县 ,云南滇红集团股份有限公司
2704,红茶制作技艺（坦洋工夫茶制作技艺）,扩展项目,福建省宁德市福安市,福安市茶业协会
2705,红茶制作技艺（宁红茶制作技艺）,扩展项目,江西省九江市修水县,江西省宁红有限责任公司
2706,乌龙茶制作技艺（铁观音制作技艺）,新增项目,福建省安溪县,安溪县茶文化研究中心
2707,乌龙茶制作技艺（漳平水仙茶制作技艺）,扩展项目,福建省龙岩市,漳平市文化馆
2708,普洱茶制作技艺（贡茶制作技艺）,新增项目,云南省宁洱哈尼族彝族自治县,宁洱哈尼族彝族自治县文化馆
2709,普洱茶制作技艺（大益茶制作技艺）,新增项目,云南省勐海县,勐海茶厂（普通合伙）
2710,黑茶制作技艺（千两茶制作技艺）,新增项目,湖南省安化县,安化县文化馆
2711,黑茶制作技艺（茯砖茶制作技艺）,新增项目,湖南省益阳市,益阳茶厂有限公司
2712,黑茶制作技艺（南路边茶制作技艺）,新增项目,四川省雅安市,雅安市非物质文化遗产和茶马古道研究保护中心
2713,黑茶制作技艺（下关沱茶制作技艺）,扩展项目,云南省大理白族自治州,云南下关沱茶（集团）股份有限公司
2714, 黑茶制作技艺（赵李桥砖茶制作技艺）,扩展项目,湖北省赤壁市,湖北省赵李桥茶厂有限责任公司
2715, 黑茶制作技艺（六堡茶制作技艺）,扩展项目,广西壮族自治区苍梧县 ,苍梧县文化馆
2716,黑茶制作技艺（长盛川青砖茶制作技艺）,扩展项目,湖北省宜昌市伍家岗区,鑫鼎生物科技有限公司
2717,黑茶制作技艺（咸阳茯茶制作技艺）,扩展项目,陕西省咸阳市,咸阳市群众艺术馆
2718,晒盐技艺（海盐晒制技艺）,新增项目,浙江省象山县,宁波信丰泰盐业科技有限公司
2719,晒盐技艺（海盐晒制技艺）,新增项目,海南省儋州市,儋州市文化馆
2720,晒盐技艺（井盐晒制技艺）,新增项目,西藏自治区芒康县,西藏自治区昌都市芒康县文化局
2721,晒盐技艺（淮盐制作技艺） ,扩展项目,江苏省连云港市,连云港市工业投资集团有限公司
2722,晒盐技艺（卤水制盐技艺） ,扩展项目,山东省寿光市 ,山东夙沙生态发展有限公司
2723,晒盐技艺（运城河东制盐技艺）,扩展项目,山西省运城市,山西焦煤运城盐化集团有限责任公司
2724,酱油酿造技艺（钱万隆酱油酿造技艺）,新增项目,上海市浦东新区,上海钱万隆酿造厂
2725,酱油酿造技艺（先市酱油酿造技艺） ,扩展项目,四川省合江县 ,合江县先市酿造食品有限公司
2726,豆瓣传统制作技艺（郫县豆瓣传统制作技艺）,新增项目,四川省郫县,成都市郫都区食品工业协会
2727,豆豉酿制技艺（永川豆豉酿制技艺）,新增项目,重庆市,重庆市永川豆豉食品有限公司
2728,豆豉酿制技艺（潼川豆豉酿制技艺）,新增项目,四川省三台县,潼川农产品开发有限责任公司
2729,腐乳酿造技艺（王致和腐乳酿造技艺）,新增项目,北京市海淀区,北京王致和食品有限公司
2730,酱菜制作技艺（六必居酱菜制作技艺）,新增项目,北京六必居食品有限公司,北京六必居食品有限公司
2731,榨菜传统制作技艺（涪陵榨菜传统制作技艺）,新增项目,重庆市涪陵区,重庆市涪陵辣妹子集团有限公司
2732,传统面食制作技艺（龙须拉面和刀削面制作技艺）,新增项目,山西省全晋会馆,山西全晋饮食文化有限公司
2733,传统面食制作技艺（抿尖面和猫耳朵制作技艺）,新增项目,山西省晋韵楼,太原清徐人家晋韵楼餐饮文化发展有限公司
2734,传统面食制作技艺（天津“狗不理”包子制作技艺）,扩展项目,天津市和平区,狗不理集团股份有限公司
2735,传统面食制作技艺（稷山传统面点制作技艺）,扩展项目,山西省稷山县,稷山赵氏四味坊传统面点传习中心
2736,传统面食制作技艺（桂发祥十八街麻花制作技艺） ,扩展项目,天津市河西区,天津桂发祥十八街麻花食品股份有限公司
2737,传统面食制作技艺（南翔小笼馒头制作技艺） ,扩展项目,上海市嘉定区 ,上海南翔老街建设发展有限公司
2738,传统面食制作技艺（太谷饼制作技艺）,扩展项目,山西省晋中市太谷区,山西鑫炳记食业股份有限公司
2739,传统面食制作技艺（李连贵熏肉大饼制作技艺）,扩展项目,吉林省四平市,四平李连贵饮食服务股份有限公司
2740,传统面食制作技艺（邵永丰麻饼制作技艺）,扩展项目,浙江省衢州市柯城区,浙江邵永丰成正食品有限公司
2741,传统面食制作技艺（缙云烧饼制作技艺）,扩展项目,浙江省丽水市缙云县,缙云县缙云烧饼协会
2742,传统面食制作技艺（老孙家羊肉泡馍制作技艺）,扩展项目,陕西省,西安饮食股份有限公司老孙家饭庄
2743,传统面食制作技艺（西安贾三灌汤包子制作技艺）,扩展项目,陕西省,西安贾三清真灌汤包子馆
2744,传统面食制作技艺（兰州牛肉面制作技艺）,扩展项目,甘肃省兰州市,兰州市文化馆
2745,传统面食制作技艺（中宁蒿子面制作技艺）,扩展项目,宁夏回族自治区中卫市中宁县,中宁县文化馆
2746,传统面食制作技艺（馕制作技艺）,扩展项目,新疆维吾尔自治区,新疆维吾尔自治区艺术研究所（新疆维吾尔自治区非物质文化遗产保护研究中心）
2747,传统面食制作技艺（塔塔尔族传统糕点制作技艺）,扩展项目,新疆维吾尔自治区塔城地区塔城市,伊犁哈萨克自治州塔城地区塔塔尔族文化协会
2748,茶点制作技艺（富春茶点制作技艺）,新增项目,江苏省扬州市,扬州富春饮服集团有限公司富春茶社
2749,周村烧饼制作技艺,新增项目,山东省淄博市,山东周村烧饼有限公司
2750,月饼传统制作技艺（郭杜林晋式月饼制作技艺）,新增项目,山西省太原市,太原双合成食品有限公司
2751,月饼传统制作技艺（安琪广式月饼制作技艺）,新增项目,广东省安琪食品有限公司,深圳安琪食品有限公司
2752,素食制作技艺（功德林素食制作技艺）,新增项目,上海功德林素食有限公司,上海功德林素食有限公司
2753,素食制作技艺（绿柳居素食烹制技艺）,扩展项目,江苏省南京市,南京金都饮食服务有限公司
2754,同盛祥牛羊肉泡馍制作技艺,新增项目,陕西省西安市,西安饮食股份有限公司同盛祥饭庄
2755,火腿制作技艺（金华火腿腌制技艺）,新增项目,浙江省金华市,金华火腿行业协会
2756,火腿制作技艺（宣威火腿制作技艺）,扩展项目,云南省宣威县,宣威市文化馆
2757,烤鸭技艺（全聚德挂炉烤鸭技艺）,新增项目,北京市全聚德（集团）股份有限公司,中国全聚德（集团）股份有限公司
2758,烤鸭技艺（便宜坊焖炉烤鸭技艺）,新增项目,北京便宜坊烤鸭集团有限公司,北京便宜坊烤鸭集团有限公司
2759,牛羊肉烹制技艺（东来顺涮羊肉制作技艺）,新增项目,北京市东来顺集团有限责任公司,北京东来顺集团有限责任公司
2760,牛羊肉烹制技艺（鸿宾楼全羊席制作技艺）,新增项目,北京市鸿宾楼餐饮有限责任公司,北京华天饮食控股集团有限公司
2761,牛羊肉烹制技艺（月盛斋酱烧牛羊肉制作技艺）,新增项目,北京月盛斋清真食品有限公司,北京月盛斋清真食品有限公司
2762,牛羊肉烹制技艺（北京烤肉制作技艺）,新增项目,北京市聚德华天控股有限公司,北京华天饮食控股集团有限公司
2763,牛羊肉烹制技艺（冠云平遥牛肉传统加工技艺）,新增项目,山西省冠云平遥牛肉集团有限公司,山西省平遥牛肉集团有限公司
2764,牛羊肉烹制技艺（烤全羊技艺）,新增项目,内蒙古自治区阿拉善盟,内蒙古阿拉善宾馆有限责任公司
2765,牛羊肉烹制技艺（宁夏手抓羊肉制作技艺）,扩展项目,宁夏回族自治区吴忠市,吴忠市文化馆
2766,天福号酱肘子制作技艺,新增项目,北京天福号食品有限公司,北京天福号食品有限公司
2767,酱肉制作技艺（亓氏酱香源肉食酱制技艺） ,扩展项目,山东省莱芜市莱城区 ,山东省亓氏酱香源食品有限公司
2768,六味斋酱肉传统制作技艺,新增项目,山西省太原六味斋实业有限公司,太原六味斋实业有限公司
2769,都一处烧麦制作技艺,新增项目,北京便宜坊烤鸭集团有限公司,北京便宜坊烤鸭集团有限公司
2770,聚春园佛跳墙制作技艺,新增项目,福建省福州市,福州聚春园集团有限公司
2771,真不同洛阳水席制作技艺,新增项目,河南省洛阳市,洛阳酒家有限责任公司
2772,官式古建筑营造技艺（北京故宫）,新增项目,故宫博物院,故宫博物院
2773,木拱桥传统营造技艺,新增项目,浙江省庆元县,庆元县文化馆
2774,木拱桥传统营造技艺,新增项目,浙江省泰顺县,泰顺县非物质文化遗产保护中心（泰顺县廊桥申遗和保护研究中心）
2775,木拱桥传统营造技艺,新增项目,福建省寿宁县,寿宁县文化馆
2776,木拱桥传统营造技艺,新增项目,福建省屏南县,屏南县木拱廊桥保护协会
2777,石桥营造技艺,新增项目,浙江省绍兴市,绍兴市古桥学会
2778,婺州传统民居营造技艺（诸葛村古村落营造技艺）,新增项目,浙江省兰溪市,兰溪市诸葛旅游发展有限公司
2779,婺州传统民居营造技艺（俞源村古建筑群营造技艺）,新增项目,浙江省武义县,武义县文化馆（武义县非物质文化遗产保护馆）
2780,婺州传统民居营造技艺（东阳卢宅营造技艺）,新增项目,浙江省东阳市,东阳市非物质文化遗产保护中心
2781,婺州传统民居营造技艺（浦江郑义门营造技艺）,新增项目,浙江省浦江县,浦江县非物质文化遗产保护中心
2782,徽派传统民居营造技艺,新增项目,安徽省黄山市,安徽省徽州古典园林建设有限公司
2783,闽南传统民居营造技艺,新增项目,福建省泉州市鲤城区,泉州市鲤城区文化馆
2784,闽南传统民居营造技艺,新增项目,福建省惠安县,惠安县文化馆
2785,闽南传统民居营造技艺,新增项目,福建省南安市,南安市博物馆
2786,闽南传统民居营造技艺 ,扩展项目,福建省厦门市湖里区 ,厦门市湖里区闽南传统建筑营造技艺传习中心
2787,窑洞营造技艺,新增项目,山西省平陆县,平陆县文化馆
2788,窑洞营造技艺,新增项目,甘肃省庆阳市,庆阳市西峰区文化馆
2789,窑洞营造技艺（地坑院营造技艺）,扩展项目,河南省陕县,三门峡市陕州区文化馆
2790,窑洞营造技艺（陕北窑洞营造技艺）,扩展项目,陕西省延安市宝塔区,延安市宝塔区文化馆
2791,蒙古包营造技艺,新增项目,内蒙古自治区文学艺术界联合会,内蒙古自治区艺术研究院（内蒙古自治区非物质文化遗产保护中心）
2792,蒙古包营造技艺,新增项目,内蒙古自治区西乌珠穆沁旗,西乌珠穆沁旗文化旅游事业发展中心
2793,蒙古包营造技艺,新增项目,内蒙古自治区陈巴尔虎旗,陈巴尔虎旗文化馆
2794,蒙古包营造技艺,扩展项目,青海省黄南藏族自治州河南蒙古族自治县,河南蒙古族自治县文化馆
2795,黎族船型屋营造技艺,新增项目,海南省东方市,东方市文化馆
2796,哈萨克族毡房营造技艺,新增项目,新疆维吾尔自治区塔城地区,伊犁哈萨克自治州塔城地区非物质文化遗产保护研究中心
2797,俄罗斯族民居营造技艺,新增项目,新疆维吾尔自治区塔城地区,塔城市文化馆
2798,撒拉族篱笆楼营造技艺,新增项目,青海省循化撒拉族自治县,循化撒拉族自治县文化馆
2799,藏族碉楼营造技艺,新增项目,四川省丹巴县,丹巴县文化馆
2800,碉楼营造技艺（羌族碉楼营造技艺）,扩展项目,四川省汶川县,汶川县文化馆
2801,碉楼营造技艺（羌族碉楼营造技艺）,扩展项目,四川省茂县,茂县文化馆
2802,碉楼营造技艺（藏族碉楼营造技艺）,扩展项目,青海省班玛县,班玛县文化馆
2803,越窑青瓷烧制技艺,新增项目,浙江省上虞市,绍兴上虞三雄陶瓷有限公司
2804,越窑青瓷烧制技艺,新增项目,浙江省杭州市,杭州市西湖区贵山窑陶瓷艺术研究室
2805,越窑青瓷烧制技艺,新增项目,浙江省慈溪市,慈溪市越窑青瓷有限公司
2806,建窑建盏烧制技艺,新增项目,福建省南平市,福建南平市星辰天目陶瓷研究所
2807,汝瓷烧制技艺,新增项目,河南省汝州市,汝州市非物质文化遗产保护中心
2808,汝瓷烧制技艺,新增项目,河南省宝丰县,宝丰县人民文化馆
2809,淄博陶瓷烧制技艺,新增项目,山东省淄博市,淄博泰山瓷业有限公司
2810,长沙窑铜官陶瓷烧制技艺,新增项目,湖南省长沙市望城区,长沙市望城区铜官陶瓷行业协会
2811,蓝夹缬技艺,新增项目,浙江省温州市,温州市非物质文化遗产保护中心
2812,中式服装制作技艺（龙凤旗袍手工制作技艺）,新增项目,上海市静安区,上海龙凤中式服装有限公司
2813,中式服装制作技艺（亨生奉帮裁缝技艺）,新增项目,上海市静安区,上海亨生西服有限公司
2814,中式服装制作技艺（培罗蒙奉帮裁缝技艺）,新增项目,上海市黄浦区,上海培罗蒙西服有限公司
2815,中式服装制作技艺（振兴祥中式服装制作技艺）,新增项目,浙江省杭州市,杭州利民中式服装股份有限公司
2816,中式服装制作技艺（满族旗袍制作技艺）,扩展项目,吉林省吉林市,吉林市艺术研究所（吉林市非物质文化遗产保护研究中心）
2817,中式服装制作技艺（红帮裁缝技艺）,扩展项目,浙江省宁波市奉化区,宁波市奉化区服装商会
2818,中式服装制作技艺（香港中式长衫制作技艺）,扩展项目,香港特别行政区,香港长衫协会
2819,铅锡刻镂技艺,新增项目,湖北省荆州市,荆州市群众艺术馆（荆州市艺术研究所）
2820,乌铜走银制作技艺,新增项目,云南省石屏县,石屏县文化馆
2821,银铜器制作及鎏金技艺,新增项目,青海省湟中县,湟中县银铜器协会
2822,银铜器制作及鎏金技艺（朔州传统鎏金技艺）,扩展项目,山西省朔州市朔城区,朔州市朔城区鎏金工艺品经销部
2823,银铜器制作及鎏金技艺（乌拉特铜银器制作技艺）,扩展项目,内蒙古自治区巴彦淖尔市乌拉特中旗,乌拉特中旗文化馆
2824,青铜器修复及复制技艺,新增项目,故宫博物院,故宫博物院
2825,青铜器修复及复制技艺（上海青铜器修复技艺）,扩展项目,上海市,上海博物馆
2826,国画颜料制作技艺（姜思序堂国画颜料制作技艺）,新增项目,江苏省苏州市,苏州姜思序堂国画颜料有限公司
2827,藏族矿植物颜料制作技艺,新增项目,西藏自治区拉萨市,拉萨市城关区古艺建筑美术公司
2828,毛笔制作技艺（周虎臣毛笔制作技艺）,新增项目,上海市黄浦区,上海周虎臣曹素功笔墨有限公司
2829,毛笔制作技艺（扬州毛笔制作技艺）,新增项目,江苏省江都市,扬州市江都区国画笔厂
2830,毛笔制作技艺（徽笔制作技艺） ,扩展项目,安徽省黄山市屯溪区,黄山市徽笔工艺研究所
2831,毛笔制作技艺（文港毛笔制作技艺）,扩展项目,江西省南昌市进贤县,进贤县文港文房四宝协会
2832,衡水法帖雕版拓印技艺,新增项目,河北省衡水市桃城区,衡水市桃城区法帖博物馆
2833,古书画临摹复制技艺,新增项目,故宫博物院,故宫博物院
2834,白茶制作技艺（福鼎白茶制作技艺）,新增项目,福建省福鼎市,福鼎市茶业协会
2835,仿膳（清廷御膳）制作技艺,新增项目,北京市西城区,北京市仿膳饭庄有限责任公司
2836,直隶官府菜烹饪技艺,新增项目,河北省保定市,保定直隶官府菜研究会
2837,孔府菜烹饪技艺,新增项目,山东省曲阜市,曲阜市公共文化服务中心（曲阜市文化馆、曲阜市图书馆、曲阜市非物质文化遗产保护中心）
2838,五芳斋粽子制作技艺,新增项目,浙江省嘉兴市,浙江五芳斋实业股份有限公司
2839,北京四合院传统营造技艺,新增项目,中国艺术研究院,中国艺术研究院
2840,雁门民居营造技艺,新增项目,山西省忻州市,山西杨氏古建筑工程有限公司
2841,石库门里弄建筑营造技艺,新增项目,上海市黄浦区,上海美达建筑工程有限公司
2842,土家族吊脚楼营造技艺,新增项目,湖北省咸丰县,咸丰县文化遗产保护中心
2843,土家族吊脚楼营造技艺,新增项目,湖南省永顺县,永顺县非物质文化遗产保护中心
2844,土家族吊脚楼营造技艺,新增项目,重庆市石柱土家族自治县,石柱土家族自治县文化生态保护管理中心
2845,维吾尔族民居建筑技艺（阿依旺赛来民居营造技艺）,新增项目,新疆维吾尔自治区和田地区,和田地区文化馆
2846,邢窑陶瓷烧制技艺 ,新增项目,河北省邢台市,邢台市邢瓷烧制技艺研究院
2847,婺州窑陶瓷烧制技艺 ,新增项目,浙江省金华市婺城区,金华婺州窑陶瓷研究所
2848,婺州窑陶瓷烧制技艺（婺州窑衢州白瓷烧制技艺）,扩展项目,浙江省衢州市柯城区,衢州火神瓷业有限公司
2849,吉州窑陶瓷烧制技艺 ,新增项目,江西省吉安市,吉安市吉州窑瓷烧制技艺研究院
2850,登封窑陶瓷烧制技艺 ,新增项目,河南省登封市,登封窑瓷苑科技有限公司
2851,当阳峪绞胎瓷烧制技艺 ,新增项目,河南省焦作市,焦作市文化馆（焦作市非物质文化遗产保护中心）
2852,潮州彩瓷烧制技艺 ,新增项目,广东省潮州市,潮州市工艺美术研究院
2853,陶瓷微书,新增项目,广东省汕头市,汕头市王芝文陶瓷微书艺术馆
2854,古陶瓷修复技艺 ,新增项目,上海市长宁区,上海高古陶瓷修复有限公司
2855,古陶瓷修复技艺,扩展项目,上海市,上海博物馆
2856,藏族鎏钴技艺 ,新增项目,青海省,青海藏医药文化博物馆
2857,铜器制作技艺（大同铜器制作技艺）,新增项目,山西省大同市城区,大同市天艺昌工艺品有限责任公司
2858,铜器制作技艺（喀什维吾尔族铜器制作技艺）,扩展项目,新疆维吾尔自治区喀什地区喀什市,喀什市文化馆
2859,古代钟表修复技艺 ,新增项目,故宫博物院,故宫博物院
2860,传统香制作技艺（药香制作技艺）,新增项目,北京市西城区,北京东天佑香业文化传播发展有限公司
2861,传统香制作技艺（莞香制作技艺）,新增项目,广东省东莞市,东莞市尚正堂莞香发展有限公司
2862,传统香制作技艺（清苑传统制香技艺）,扩展项目,河北省保定市清苑区,河北古城香业集团股份有限公司
2863,传统香制作技艺（福建香制作技艺）,扩展项目,福建省,福建省艺术馆（福建省非物质文化遗产保护中心）
2864,一得阁墨汁制作技艺 ,新增项目,北京市西城区,北京一得阁墨业有限责任公司
2865,奶制品制作技艺（察干伊德）,新增项目,内蒙古自治区正蓝旗,正蓝旗文体旅游广电事业发展中心
2866,辽菜传统烹饪技艺,新增项目,辽宁省沈阳市,沈阳鹿鸣春饭店有限公司
2867,泡菜制作技艺（朝鲜族泡菜制作技艺）,新增项目,吉林省延吉市,延吉友谊有限公司
2868,老汤精配制,新增项目,黑龙江省哈尔滨市阿城区,哈尔滨粒粒香食品股份有限公司
2869,上海本帮菜肴传统烹饪技艺 ,新增项目,上海市黄浦区,上海老饭店
2870,传统制糖技艺（义乌红糖制作技艺）,新增项目,浙江省义乌市,义乌市五亭现代农业开发有限公司
2871,豆腐传统制作技艺 ,新增项目,安徽省淮南市,淮南市八公山豆制品有限责任公司
2872,豆腐传统制作技艺 ,新增项目,安徽省寿县,安徽八公山豆制品有限公司
2873,豆腐传统制作技艺,扩展项目,山东省泰安市泰山区,泰安市东岳泰山豆腐宴文化研究院
2874,德州扒鸡制作技艺 ,新增项目,山东省德州市,山东德州扒鸡股份有限公司
2875,龙口粉丝传统制作技艺 ,新增项目,山东省招远市,烟台双塔食品股份有限公司
2876,蒙自过桥米线制作技艺 ,新增项目,云南省蒙自市,蒙自市文化馆
2877,坎儿井开凿技艺 ,新增项目,新疆维吾尔自治区吐鲁番市,吐鲁番市高昌区文化馆
2878,古建筑模型制作技艺,新增项目,山西省太原市,山西古典艺术研究院(有限公司）
2879,传统造园技艺（扬州园林营造技艺）,新增项目,江苏省扬州市,扬州古典园林建设有限公司
2880,古戏台营造技艺 ,新增项目,江西省乐平市,乐平市文化馆
2881,庐陵传统民居营造技艺 ,新增项目,江西省泰和县,泰和县文化馆
2882,古建筑修复技艺 ,新增项目,甘肃省永靖县,甘肃古典建设集团有限公司
2883,八义窑红绿彩瓷烧制技艺,新增项目,山西省长治市上党区,山西长治八义窑红绿彩陶瓷文化有限公司
2884,鲁山窑烧制技艺（鲁山花瓷烧制技艺）,新增项目,河南省平顶山市鲁山县,鲁山县文化馆
2885,北京蒙镶技艺,新增项目,北京市东城区,北京吴中凤蒙镶艺术品有限公司
2886,缂丝织造技艺（定州缂丝织造技艺）,新增项目,河北省保定市定州市,定州市文化馆
2887,花边制作技艺（萧山花边制作技艺）,新增项目,浙江省杭州市萧山区,杭州市萧山区文化馆（杭州市萧山区非物质文化遗产保护中心）
2888,彩带编织技艺（畲族彩带编织技艺）,新增项目,浙江省丽水市景宁畲族自治县,景宁畲族自治县文物和非遗保护中心
2889,丝绸染织技艺（周村丝绸染织技艺）,新增项目,山东省淄博市周村区,淄博凯利丝绸有限公司
2890,佤族织锦技艺,新增项目,云南省普洱市西盟佤族自治县,西盟佤族自治县文化馆
2891,铸铁技艺（永康铸铁技艺）,新增项目,浙江省金华市永康市,永康一本堂艺术品有限公司
2892,青铜器制作技艺（青铜编钟制作技艺）,新增项目,湖北省随州市曾都区,随州市曾侯乙编钟编磬文化有限公司
2893,刀剑锻制技艺（七台河刀剑锻制技艺）,新增项目,黑龙江省七台河市,七台河市英雄工艺刀剑锻造有限公司
2894,银胎掐丝珐琅器制作技艺（永胜珐琅银器制作技艺）,新增项目,云南省丽江市永胜县,永胜县文化馆
2895,金镶玉制作技艺（郏县金镶玉制作技艺）,新增项目,河南省平顶山市郏县,郏县文化馆
2896,制漆技艺（坝漆制作技艺）,新增项目,湖北省恩施土家族苗族自治州利川市,利川市德隆生漆科技有限责任公司
2897,书画毡制作技艺（定兴书画毡制作技艺）,新增项目,河北省保定市定兴县,定兴县何中堂文化用品制造有限公司
2898,简牍制作技艺（楚简制作技艺）,新增项目,湖北省荆州市,荆州市楚韵阁简牍艺术研发中心
2899,麻纸制作技艺（西和麻纸制作技艺）,新增项目,甘肃省陇南市西和县,西和县非物质文化遗产保护中心
2900,传统书籍装帧技艺,新增项目,国家图书馆,国家图书馆
2901,宫廷传统囊匣制作技艺,新增项目,故宫博物院,故宫博物院
2902,脂粉制作技艺（谢馥春脂粉制作技艺）,新增项目,江苏省扬州市,江苏谢馥春国妆股份有限公司
2903,骨器制作技艺（白沙黎族骨器制作技艺）,新增项目,海南省白沙黎族自治县,海南省白沙黎族自治县文化馆
2904,云南围棋子（云子、永子）制作技艺,新增项目,云南省,云南省非物质文化遗产保护中心
2905,擦擦制作技艺（拉萨擦擦制作技艺）,新增项目,西藏自治区拉萨市,拉萨贡德泥塑文化艺术发展有限公司
2906,葫芦制作技艺（天津葫芦制作技艺）,新增项目,天津市宝坻区,葫芦庐（天津）文化传播有限公司
2907,葫芦制作技艺（文水葫芦制作技艺）,新增项目,山西省吕梁市文水县,文水县石安葫芦种植加工协会
2908,严东关五加皮酿酒技艺,新增项目,浙江省杭州市建德市,浙江致中和实业有限公司
