,名称,类别,申报单位,保护单位
0,苗族古歌,新增项目,贵州省台江县,台江县非物质文化遗产保护中心
1,苗族古歌,新增项目,贵州省黄平县,黄平县非物质文化遗产保护中心
2,苗族古歌,扩展项目,湖南省花垣县,花垣县非物质文化遗产保护中心
3,苗族古歌（簪汪传）,扩展项目,贵州省贵阳市清镇市,清镇市文化馆
4,布洛陀,新增项目,广西壮族自治区田阳县,田阳县文化馆
5,遮帕麻和遮咪麻,新增项目,云南省梁河县,梁河县文化馆
6,牡帕密帕,新增项目,云南省思茅市,澜沧拉祜族自治县文化馆
7,刻道,新增项目,贵州省施秉县,施秉县非物质文化遗产保护中心
8,白蛇传传说,新增项目,江苏省镇江市,镇江市非物质文化遗产保护中心
9,白蛇传传说,新增项目,浙江省杭州市,杭州市文化馆（杭州市非物质文化遗产保护中心）
10,梁祝传说,新增项目,江苏省宜兴市,宜兴市华夏梁祝文化研究会
11,梁祝传说,新增项目,浙江省宁波市,宁波梁祝文化园管理有限公司
12,梁祝传说,新增项目,浙江省杭州市,杭州市文化馆（杭州市非物质文化遗产保护中心）
13,梁祝传说,新增项目,浙江省上虞市,绍兴市上虞区文化馆（区非物质遗产保护中心）
14,梁祝传说,新增项目,山东省济宁市,济宁市梁祝文化研究会
15,梁祝传说,新增项目,河南省汝南县,汝南县文化馆
16,孟姜女传说,新增项目,山东省淄博市,淄博市淄川区公共文化服务中心（加挂淄川区文化馆、淄川区美术馆牌子）
17,孟姜女传说,扩展项目,河北省秦皇岛市,秦皇岛市山海关区文化馆
18,孟姜女传说,扩展项目,湖南省津市市,津市市文化馆（津市市美术馆）
19,孟姜女传说,扩展项目,山东省莒县,莒县文化馆
20,孟姜女传说,扩展项目,山东省莱芜市莱城区,济南市文化馆（济南市非物质文化遗产保护中心、济南市艺术创作研究院）
21,董永传说,新增项目,山西省万荣县,万荣县文化馆
22,董永传说,新增项目,江苏省东台市,东台市文化馆
23,董永传说,新增项目,河南省武陟县,武陟县董永文化服务中心
24,董永传说,新增项目,湖北省孝感市,孝感市群众艺术馆（孝感市非物质文化遗产保护中心）
25,董永传说,扩展项目,江苏省金坛市,常州市金坛区文化馆
26,董永传说,扩展项目,山东省博兴县,博兴县文化馆
27,董永传说,扩展项目,江苏省丹阳市,丹阳市文化馆
28,西施传说,新增项目,浙江省诸暨市,诸暨市博物馆
29,济公传说,新增项目,浙江省天台县,台州市天台山文化研究会
30,满族说部,新增项目,吉林省,吉林省艺术研究院（吉林省文化行业特有工种职业技能鉴定站、吉林省东北二人转博物馆、吉林省非物质文化遗产保护中心）
31,满族说部（孙吴县满语故事）,扩展项目,黑龙江省黑河市孙吴县,孙吴县文化馆
32,河西宝卷,新增项目,甘肃省武威市凉州区,凉州区文化馆
33,河西宝卷,新增项目,甘肃省酒泉市肃州区,肃州区文化馆
34,宝卷（靖江宝卷）,扩展项目,江苏省靖江市,靖江市文化馆
35,宝卷（河西宝卷）,扩展项目,甘肃省张掖市,张掖市文化馆（张掖市非物质文化遗产传承保护中心）
36,宝卷（吴地宝卷）,扩展项目,江苏省苏州市,苏州市非物质文化遗产保护管理办公室（苏州市文化研究中心）
37,宝卷（岷县宝卷）,扩展项目,甘肃省定西市岷县,岷县文化馆
38,耿村民间故事,新增项目,河北省藁城市,石家庄市藁城区文化馆
39,伍家沟民间故事,新增项目,湖北省丹江口市,丹江口市文化馆
40,下堡坪民间故事,新增项目,湖北省宜昌市夷陵区,宜昌市夷陵区文化馆
41,走马镇民间故事,新增项目,重庆市九龙坡区,重庆市九龙坡区文化馆
42,古渔雁民间故事,新增项目,辽宁省大洼县,盘锦市大洼区文化体育旅游发展促进中心（大洼区总工会文体活动管理中心）
43,喀左东蒙民间故事,新增项目,辽宁省喀喇沁左翼蒙古族自治县,喀喇沁左翼蒙古族自治县公共文化和广播电视工作服务中心
44,谭振山民间故事,新增项目,辽宁省新民市,新民市文化馆（新民市考古和文物保护中心）
45,河间歌诗,新增项目,河北省河间市,河间市文化馆
46,吴歌,新增项目,江苏省苏州市,苏州市非物质文化遗产保护管理办公室（苏州市文化研究中心）
47,吴歌,扩展项目,江苏省无锡市,无锡市锡山区吴歌锡剧研究会
48,吴歌,扩展项目,上海市青浦区,上海市青浦区文化馆（上海青浦画院）
49,刘三姐歌谣,新增项目,广西壮族自治区宜州市,河池市宜州区刘三姐文化传承中心（河池市宜州区非物质文化遗产保护中心）
50,四季生产调,新增项目,云南省红河哈尼族彝族自治州,红河哈尼族彝族自治州非物质文化遗产保护中心
51,玛纳斯,新增项目,新疆维吾尔自治区克孜勒苏柯尔克孜自治州,克孜勒苏柯尔克孜自治州非物质文化遗产保护（玛纳斯保护研究）中心
52,玛纳斯,新增项目,新疆维吾尔自治区文联民间文艺家协会,新疆维吾尔自治区民间文艺家协会，新疆维吾尔自治区艺术研究所（新疆维吾尔自治区非物质文化遗产保护研究中心）
53,江格尔,新增项目,新疆维吾尔自治区和布克塞尔蒙古自治县,和布克赛尔蒙古自治县非物质文化遗产保护中心
54,江格尔,新增项目,新疆维吾尔自治区博尔塔拉蒙古自治州,博尔塔拉蒙古自治州文化馆
55,江格尔,新增项目,新疆维吾尔自治区巴音郭楞蒙古自治州,新疆巴音郭楞蒙古自治州文化馆
56,江格尔,新增项目,新疆维吾尔自治区文联民间文艺家协会,新疆维吾尔自治区民间文艺家协会
57,江格尔,扩展项目,内蒙古自治区,内蒙古自治区艺术研究院（内蒙古自治区非物质文化遗产保护中心）
58,格萨（斯）尔,新增项目,内蒙古自治区,内蒙古自治区少数民族古籍征集研究室
59,格萨（斯）尔,新增项目,四川省,甘孜藏族自治州文化馆
60,格萨（斯）尔,新增项目,云南省,迪庆藏族自治州非物质文化遗产保护中心
61,格萨（斯）尔,新增项目,西藏自治区,西藏自治区文化厅
62,格萨（斯）尔,新增项目,甘肃省,西北民族大学
63,格萨（斯）尔,新增项目,青海省,青海省文学艺术界联合会
64,格萨（斯）尔,新增项目,新疆维吾尔自治区,新疆维吾尔自治区民间文艺家协会
65,格萨（斯）尔,新增项目,中国社会科学院《格萨（斯）尔》办公室,中国社会科学院《格萨（斯）尔》办公室
66,格萨（斯）尔,扩展项目,内蒙古自治区巴林右旗,巴林右旗格斯尔文化研究发展中心
67,阿诗玛,新增项目,云南省石林彝族自治县,石林彝族自治县阿诗玛文化传承与保护中心（石林彝族自治县阿诗玛文化研究所、石林彝族自治县非物质文化遗产保护中心）
68,拉仁布与吉门索,新增项目,青海省互助土族自治县,互助土族自治县文化馆
69,畲族小说歌,新增项目,福建省霞浦县,霞浦县福宁文化艺术交流中心
70,青林寺谜语,新增项目,湖北省宜都市,宜都市文化馆（宜都市文艺创作室）
71,谜语（澄海灯谜）,扩展项目,广东省汕头市澄海区,汕头市澄海区文化馆
72,八达岭长城传说,新增项目,北京市延庆县,北京市延庆区博物馆（北京市延庆区文物管理所）
73,永定河传说,新增项目,北京市石景山区,北京市石景山区非物质文化遗产保护中心
74,杨家将传说（穆桂英传说）,新增项目,北京市房山区,北京市房山区燕山文化馆
75,杨家将传说（杨家将说唱）,新增项目,山西省,广灵县文化馆
76,杨家将传说（杨七郎墓传说）,扩展项目,天津市宁河县,天津市宁河区文化馆
77,尧的传说,新增项目,山西省绛县,绛县文化馆
78,尧的传说,扩展项目,山东省菏泽市牡丹区,菏泽市牡丹区文化馆
79,牛郎织女传说,新增项目,山西省和顺县,和顺县文化馆
80,牛郎织女传说,新增项目,山东省沂源县,沂源县文化馆（沂源县非物质文化遗产保护中心、沂源县书画院）
81,牛郎织女传说,扩展项目,陕西省西安市长安区,西咸新区沣东新城斗门街道办事处
82,西湖传说,新增项目,浙江省杭州市,杭州图书馆
83,刘伯温传说,新增项目,浙江省文成县,文成县非物质文化遗产保护中心
84,刘伯温传说,新增项目,浙江省青田县,青田县刘基研究会
85,黄初平（黄大仙）传说,新增项目,浙江省金华市,金华黄大仙文化研究会
86,观音传说,新增项目,浙江省舟山市,舟山市普陀山风景名胜区管理委员会
87,徐福东渡传说,新增项目,浙江省象山县,象山县文化馆
88,徐福东渡传说,新增项目,浙江省慈溪市,慈溪市徐福研究会
89,徐福传说,扩展项目,山东省胶南市,青岛市黄岛区琅琊暨徐福研究会
90,徐福传说,扩展项目,山东省青岛市黄岛区,青岛市黄岛区文化馆
91,徐福传说,扩展项目,江苏省赣榆县,连云港市赣榆区金山镇文化站
92,陶朱公传说,新增项目,山东省定陶县,菏泽市定陶区文化馆
93,麒麟传说,新增项目,山东省巨野县,巨野县文化馆
94,麒麟传说,新增项目,山东省嘉祥县,嘉祥县公共文化服务中心（嘉祥县图书馆、嘉祥县文化馆）
95,鲁班传说,新增项目,山东省曲阜市,曲阜市公共文化服务中心（曲阜市文化馆、曲阜市图书馆、曲阜市非物质文化遗产保护中心）
96,鲁班传说,新增项目,山东省滕州市,山东省滕州市文化馆
97,八仙传说,新增项目,山东省蓬莱市,蓬莱市文化馆
98,秃尾巴老李的传说,新增项目,山东省即墨市,青岛圣龙山旅游开发有限公司
99,秃尾巴老李的传说,新增项目,山东省莒县,莒县文化馆
100,秃尾巴老李的传说,新增项目,山东省文登市,威海市文登区文化馆（威海市文登区非物质文化遗产保护中心、威海市文登区美术馆）
101,秃尾巴老李的传说,新增项目,山东省诸城市,诸城市文化馆
102,屈原传说,新增项目,湖北省秭归县,秭归县文化馆（县非物质文化遗产保护中心）
103,王昭君传说,新增项目,湖北省兴山县,兴山县文化馆
104,炎帝神农传说,新增项目,湖北省随州市,随县文化馆（随县非物质文化遗产保护中心）
105,炎帝神农传说,新增项目,湖北省神农架林区,神农架林区群众艺术馆
106,木兰传说,新增项目,河南省虞城县,虞城县文化馆
107,木兰传说,新增项目,湖北省武汉市黄陂区,武汉市黄陂区文化馆（武汉市黄陂区非物质文化遗产保护中心）
108,木兰传说,扩展项目,陕西省延安市宝塔区,延安市宝塔区文化馆
109,巴拉根仓的故事,新增项目,内蒙古自治区通辽市,通辽市群众艺术馆
110,北票民间故事,新增项目,辽宁省北票市,北票市文旅体育事务服务中心（北票市博物馆、北票市文物考古研究所、北票市尹湛纳希纪念馆）
111,满族民间故事,新增项目,辽宁省文学艺术界联合会民间文艺家协会,辽宁省文化遗产保护中心（辽宁省非物质文化遗产保护中心）
112,徐文长故事,新增项目,浙江省绍兴市,绍兴市文化馆、绍兴市非物质文化遗产保护中心
113,崂山民间故事,新增项目,山东省青岛市崂山区,青岛市崂山区文化旅游产业协会
114,都镇湾故事,新增项目,湖北省长阳土家族自治县,长阳土家族自治县民族民间传统文化保护中心
115,盘古神话,新增项目,河南省桐柏县,桐柏县人民文化馆
116,盘古神话,新增项目,河南省泌阳县,泌阳县文化馆
117,邵原神话群,新增项目,河南省济源市,济源市邵原镇女娲文化研究基地
118,嘎达梅林,新增项目,内蒙古自治区科尔沁左翼中旗,科尔沁左翼中旗文化遗产保护中心
119,科尔沁潮尔史诗,新增项目,内蒙古自治区,内蒙古师范大学
120,仰阿莎,新增项目,贵州省黔东南苗族侗族自治州,黔东南苗族侗族自治州文化研究所
121,布依族盘歌,新增项目,贵州省盘县,盘州市非物质文化遗产保护中心
122,梅葛,新增项目,云南省楚雄彝族自治州,楚雄彝族自治州非物质文化遗产保护中心
123,查姆,新增项目,云南省双柏县,双柏县文化馆
124,达古达楞格莱标,新增项目,云南省德宏傣族景颇族自治州,德宏州文化馆
125,哈尼哈吧,新增项目,云南省元阳县,元阳县文化馆
126,召树屯与喃木诺娜,新增项目,云南省西双版纳傣族自治州,西双版纳傣族自治州文化馆
127,米拉尕黑,新增项目,甘肃省东乡族自治县,东乡族自治县文化馆
128,康巴拉伊,新增项目,青海省治多县,治多县民族语文工作中心
129,汗青格勒,新增项目,青海省海西蒙古族藏族自治州,海西州文化馆（海西州非物质文化遗产传承保护中心、 海西州民族文化体育活动中心）
130,维吾尔族达斯坦,新增项目,新疆维吾尔自治区,新疆维吾尔自治区民间文艺家协会
131,哈萨克族达斯坦,新增项目,新疆维吾尔自治区文学艺术界联合会民间文艺家协会,新疆维吾尔自治区民间文艺家协会
132,哈萨克族达斯坦,新增项目,新疆维吾尔自治区沙湾县,沙湾县文化馆
133,哈萨克族达斯坦,新增项目,新疆维吾尔自治区福海县,福海县文化馆
134,珠郎娘美,新增项目,贵州省榕江县,榕江县非物质文化遗产保护中心
135,珠郎娘美,新增项目,贵州省从江县,从江县非物质文化遗产保护中心
136,司岗里,新增项目,云南省沧源佤族自治县,沧源佤族自治县文化馆
137,司岗里,扩展项目,云南省西盟佤族自治县,西盟佤族自治县文化馆
138,彝族克智,新增项目,四川省美姑县,美姑县文化馆
139,苗族贾理,新增项目,贵州省黔东南苗族侗族自治州,黔东南苗族侗族自治州文化研究所
140,藏族婚宴十八说,新增项目,青海省,青海省文化馆
141,童谣（北京童谣）,新增项目,北京市宣武区,北京市宣武师范学校附属第一小学
142,童谣（闽南童谣）,新增项目,福建省厦门市,厦门市集美区灌口小学（福建省厦门实验小学集美分校）
143,童谣（绍兴童谣）,扩展项目,浙江省绍兴市,绍兴市文化馆、绍兴市非物质文化遗产保护中心
144,童谣（纳西族童谣）,扩展项目,云南省丽江市古城区,古城区非物质文化遗产保护管理中心
145,桐城歌,新增项目,安徽省桐城市,桐城市文化馆
146,土家族梯玛歌,新增项目,湖南省龙山县,龙山县非物质文化遗产保护中心
147,雷州歌,新增项目,广东省雷州市,雷州市雷歌研究会
148,壮族嘹歌,新增项目,广西壮族自治区平果县,平果市文化体育推广中心（平果市民俗文化传承展示中心）
149,柯尔克孜约隆,新增项目,新疆维吾尔自治区阿克陶县,新疆阿克陶县文化馆
150,柯尔克孜约隆,新增项目,新疆师范大学,新疆师范大学
151,笑话（万荣笑话）,新增项目,山西省万荣县,万荣县笑话发展协会
152,天坛传说,新增项目,北京市东城区,北京市天坛公园管理处
153,曹雪芹传说,新增项目,北京市海淀区,北京市植物园
154,契丹始祖传说,新增项目,河北省平泉县,平泉市文化馆
155,赵氏孤儿传说,新增项目,山西省盂县,盂县人民文化馆
156,白马拖缰传说,新增项目,山西省晋城市城区,晋城市城区文化馆
157,舜的传说,新增项目,山西省沁水县,沁水县文化馆
158,舜的传说,新增项目,山东省诸城市,诸城市文化馆
159,禹的传说,新增项目,四川省汶川县,汶川县文化馆
160,禹的传说,新增项目,四川省北川羌族自治县,北川羌族自治县文化馆
161,禹的传说（武汉大禹治水传说）,扩展项目,湖北省武汉市汉阳区,武汉市晴川阁管理处（武汉大禹文化博物馆）
162,防风传说,新增项目,浙江省德清县,德清县文化馆
163,盘瓠传说,新增项目,湖南省泸溪县,泸溪县非物质文化遗产保护中心
164,庄子传说,新增项目,山东省东明县,山东省东明县文化馆
165,柳毅传说,新增项目,山东省潍坊市寒亭区,潍坊市寒亭区文化馆
166,禅宗祖师传说,新增项目,湖北省黄梅县,黄梅县文化馆
167,禅宗祖师传说（六祖传说）,扩展项目,广东省云浮市新兴县,新兴县文化馆
168,布袋和尚传说,新增项目,浙江省奉化市,宁波市奉化区文化馆
169,钱王传说,新增项目,浙江省临安市,杭州市临安区文化馆（杭州市临安区非物质文化遗产保护中心）
170,苏东坡传说,新增项目,浙江省杭州市,杭州西湖博物馆总馆（西湖学研究院、杭州西湖风景名胜区网宣中心）
171,苏东坡传说,扩展项目,湖北省黄冈市,黄冈市群众艺术馆（黄冈市民俗博物馆）
172,王羲之传说,新增项目,浙江省绍兴市,绍兴市文化馆、绍兴市非物质文化遗产保护中心
173,李时珍传说,新增项目,湖北省蕲春县,蕲春县文化馆
174,蔡伦造纸传说,新增项目,陕西省汉中市,汉中市民间文艺家协会
175,牡丹传说,新增项目,山东省菏泽市牡丹区,菏泽市牡丹区文化馆
176,泰山传说,新增项目,山东省泰安市,泰安市泰山风景名胜区管理委员会（泰山林场）
177,黄鹤楼传说,新增项目,湖北省武汉市武昌区,武汉市黄鹤楼公园管理处
178,烂柯山的传说,新增项目,山西省陵川县,陵川县文化馆（陵川县上党梆子传习所）
179,烂柯山的传说,新增项目,浙江省衢州市,衢州市文化馆（衢州市非物质文化遗产保护中心）
180,珞巴族始祖传说,新增项目,西藏自治区米林县,西藏林芝市米林县文化和旅游局
181,阿尼玛卿雪山传说,新增项目,青海省果洛藏族自治州,果洛州文化馆（果洛州非物质文化遗产传承保护中心、果洛州群众体育指导服务中心）
182,锡伯族民间故事,新增项目,辽宁省沈阳市,沈阳市于洪区文化旅游体育事务服务中心
183,嘉黎民间故事,新增项目,西藏自治区嘉黎县,西藏那曲市嘉黎县文化和旅游局
184,海洋动物故事,新增项目,浙江省洞头县,温州市洞头区民间文艺工作者协会
185,土家族哭嫁歌,新增项目,湖南省永顺县,永顺县非物质文化遗产保护中心
186,土家族哭嫁歌,新增项目,湖南省古丈县,古丈县非物质文化遗产保护中心
187,坡芽情歌,新增项目,云南省富宁县,富宁县文化馆
188,祝赞词,新增项目,内蒙古自治区东乌珠穆沁旗,东乌珠穆沁旗文化馆
189,祝赞词,新增项目,新疆维吾尔自治区博湖县,博湖县非物质文化遗产保护中心
190,祝赞词,新增项目,新疆维吾尔自治区和布克赛尔蒙古自治县,和布克赛尔蒙古自治县非物质文化遗产保护中心
191,祝赞词（肃北蒙古族祝赞词）,扩展项目,甘肃省酒泉市肃北蒙古族自治县,肃北蒙古族自治县文化馆
192,黑暗传,新增项目,湖北省保康县,保康县文化馆
193,黑暗传,新增项目,湖北省神农架林区,神农架林区群众艺术馆
194,陶克陶胡,新增项目,吉林省前郭尔罗斯蒙古族自治县,前郭尔罗斯蒙古族自治县文化工作总站（前郭县非物质文化遗产保护中心）
195,密洛陀,新增项目,广西壮族自治区都安瑶族自治县,都安瑶族自治县文化馆
196,亚鲁王,新增项目,贵州省紫云苗族布依族自治县,紫云苗族布依族自治县亚鲁王文化研究中心
197,目瑙斋瓦,新增项目,云南省德宏傣族景颇族自治州,德宏州文化馆
198,洛奇洛耶与扎斯扎依,新增项目,云南省墨江哈尼族自治县,墨江哈尼族自治县文化馆
199,阿细先基,新增项目,云南省弥勒县,弥勒市文化馆
200,羌戈大战,新增项目,四川省汶川县,汶川县文化馆
201,恰克恰克,新增项目,新疆维吾尔自治区伊宁市,伊宁市文化馆
202,酉阳古歌,新增项目,重庆市酉阳土家族苗族自治县,酉阳土家族苗族自治县文化馆（酉阳土家族苗族自治县文化生态保护中心、酉阳土家族苗族自治县非物质文化遗产保护中心）
203,谚语（沪谚）,新增项目,上海市闵行区,上海市闵行区浦江镇文化体育事业发展中心
204,谚语（陕北民谚）,扩展项目,陕西省榆林市,榆林市公共文化服务中心（榆林市博物馆、榆林市图书馆、榆林市文化馆）
205,谚语（哈萨克族谚语）,扩展项目,新疆维吾尔自治区伊犁哈萨克自治州特克斯县,特克斯县文化馆
206,卢沟桥传说,新增项目,北京市丰台区,北京市丰台区文化馆
207,鬼谷子传说 ,新增项目,河北省临漳县,临漳县文化馆
208,东海孝妇传说,新增项目,江苏省连云港市,连云港市孝文化研究会
209,刘阮传说,新增项目,浙江省天台县,台州市天台山文化研究会
210,孔雀东南飞传说,新增项目,安徽省怀宁县,怀宁县文化馆
211,孔雀东南飞传说,新增项目,安徽省潜山县,潜山市文化馆
212,老子传说,新增项目,安徽省涡阳县,涡阳县文化馆
213,老子传说,新增项目,河南省灵宝市,灵宝市文化馆
214,陈三五娘传说,新增项目,福建省泉州市洛江区,泉州市洛江区文化馆
215,胡峄阳传说,新增项目,山东省青岛市城阳区,青岛城阳流亭峄阳文化园
216,孟母教子传说,新增项目,山东省邹城市,邹城市文化旅游公共服务中心（邹城市图书馆、邹城市文化馆）
217,河图洛书传说,新增项目,河南省洛阳市,洛阳市文化馆（洛阳市非物质文化遗产保护中心）
218,杞人忧天传说,新增项目,河南省杞县,杞县人民文化馆（杞县送戏下乡艺术团）
219,三国传说,新增项目,湖北省,湖北省群众艺术馆（湖北省非物质文化遗产保护中心）
220,伯牙子期传说,新增项目,湖北省武汉市,武汉市群众艺术馆
221,尹吉甫传说,新增项目,湖北省房县,房县文化馆
222,苏仙传说,新增项目,湖南省郴州市苏仙区,郴州市苏仙区文化馆
223,毕阿史拉则传说,新增项目,四川省金阳县,金阳县文化馆
224,仓颉传说,新增项目,陕西省洛南县,洛南县文化馆
225,仓颉传说,新增项目,陕西省白水县,白水县文化馆
226,骆驼泉传说,新增项目,青海省循化撒拉族自治县,循化撒拉族自治县文化馆
227,回族民间故事,新增项目,宁夏回族自治区泾源县,泾源县文化馆
228,广禅侯故事,新增项目,山西省阳城县,阳城县文化馆
229,解缙故事,新增项目,江西省吉水县,吉水县文化馆
230,壮族百鸟衣故事,新增项目,广西壮族自治区横县,横县文化馆（横县非物质文化遗产保护中心）
231,阿凡提故事,新增项目,新疆维吾尔自治区喀什地区,喀什地区文化馆
232,广阳镇民间故事,新增项目,重庆市南岸区,重庆市南岸区文化馆
233,西王母神话,新增项目,新疆维吾尔自治区阜康市,新疆天池管理委员会（新疆天山天池风景名胜区管理委员会、新疆天池博格达峰自然保护区管理局）
234,盘王大歌,新增项目,湖南省江华瑶族自治县,江华瑶族自治县文化馆
235,玛牧,新增项目,四川省喜德县,喜德县文化馆（喜德县美术馆）
236,黑白战争,新增项目,云南省丽江市古城区,古城区非物质文化遗产保护管理中心
237,祁家延西,新增项目,青海省互助土族自治县,互助土族自治县文化馆
238,常山喝彩歌谣,新增项目,浙江省常山县,常山县文化馆
239,八大处传说,新增项目,北京市石景山区,北京市八大处公园管理处
240,玄奘传说,新增项目,河南省洛阳市偃师区,洛阳市偃师区人民文化馆
241,女娲传说,新增项目,湖北省十堰市竹山县,竹山县文化馆
242,老司城传说,新增项目,湖南省湘西土家族苗族自治州永顺县,永顺县非物质文化遗产保护中心
243,珠玑巷人南迁传说,新增项目,广东省韶关市南雄市,南雄市非物质文化遗产传承保护中心
244,张骞传说,新增项目,陕西省汉中市城固县,城固县文化馆
245,藏族民间传说（年保玉则传说）,新增项目,青海省果洛藏族自治州久治县,久治县文化馆
246,鄂温克族民间故事,新增项目,内蒙古自治区呼伦贝尔市鄂温克族自治旗,鄂温克族自治旗文化旅游事业发展中心（鄂温克族自治旗文化馆、鄂温克族自治旗非物质文化遗产保护中心）
247,包公故事,新增项目,安徽省合肥市,合肥市文化馆
248,仫佬族古歌,新增项目,广西壮族自治区河池市罗城仫佬族自治县,罗城仫佬族自治县文化馆
249,巴狄雄萨滚,新增项目,贵州省铜仁市松桃苗族自治县,松桃苗族自治县文化馆
250,都玛简收,新增项目,云南省红河哈尼族彝族自治州绿春县,绿春县文化馆（绿春县非物质文化遗产保护中心）
251,左权开花调,新增项目,山西省左权县,左权县人民文化馆
252,河曲民歌,新增项目,山西省河曲县,河曲县宣传事务中心
